{
  "title": "JS Code Club [Online] - February 2024",
  "hosts": [
    "Ken B."
  ],
  "startDate": "2024-02-24T16:00:00-05:00",
  "endDate": "2024-02-24T16:00:00-05:00",
  "status": "active",
  "locationType": "virtual",
  "image": "https://secure.meetupstatic.com/photos/event/a/0/3/e/600_519101022.webp?w=750",
  "details": "<div class=\"flex items-center justify-between\"><h2 class=\"text-xl font-semibold\">Details</h2></div><div class=\"break-words\"><p class=\"mb-4\">After taking a break for a couple of months, Code Club is back for its first event of the year!</p>\n<p class=\"mb-4\">TorontoJS Code Club is a friendly coding environment where we can bounce ideas &amp; ask questions freely while working on software challenges together.</p>\n<p class=\"mb-4\">Please bring your projects/ideas to the event, or just show up and contribute to the discussion!</p>\n<ul class=\"pl-5 list-disc mb-4\">\n<li></li>\n</ul>\n<p class=\"mb-4\">We can tackle an open-source issue together. Some issues don't require much context to solve and are suitable for beginners too. This group programming event can be a great opportunity to start your open-source journey.</p>\n<ul class=\"pl-5 list-disc mb-4\">\n<li></li>\n</ul>\n<p class=\"mb-4\">Are you job searching? We can take a look at Leetcode-style interview questions together.</p>\n<ul class=\"pl-5 list-disc mb-4\">\n<li></li>\n</ul>\n<p class=\"mb-4\">Countless new libraries appear in the JS ecosystem every year. We can try out a new piece of tech together and share our first impressions.</p>\n<p class=\"mb-4\">This event is not about competition or achievements. Come for the pure joy of building.</p>\n<p class=\"mb-4\">The event will be held on the TorontoJS <a href=\"https://discord.gg/EfVDg9prGf?event=1205954886861066300\" target=\"_blank\" class=\"!text-viridian\" rel=\"nofollow ugc\">discord</a>.</p>\n<p class=\"mb-4\">The <a href=\"https://torontojs.com/code_of_conduct\" target=\"_blank\" class=\"!text-viridian\" rel=\"nofollow ugc\">TorontoJS Code of Conduct</a> is enforced at all TorontoJS events.</p>\n<p class=\"mb-4\">Find out more information about events @ <a href=\"https://guild.host/torontojs/events\" target=\"_blank\" class=\"!text-viridian\" rel=\"nofollow ugc\">Guild</a></p></div>",
  "tags": [
    "Events in",
    "JavaScript",
    "JavaScript Applications",
    "JavaScript Frameworks",
    "JavaScript Libraries",
    "Web Technology"
  ]
}