{
  "title": "JS Tech Talk[Online]: Hussien Khayoon React Testing",
  "hosts": [
    "Ken B.",
    "sami x."
  ],
  "startDate": "2024-02-29T18:30:00-05:00",
  "endDate": "2024-02-29T18:30:00-05:00",
  "status": "active",
  "locationType": "virtual",
  "image": "https://secure.meetupstatic.com/photos/event/a/1/6/b/600_517481323.webp?w=750",
  "details": "<div class=\"flex items-center justify-between\"><h2 class=\"text-xl font-semibold\">Details</h2></div><div class=\"break-words\"><p class=\"mb-4\">ðŸ™Œ TorontoJS tech talks are now online!</p>\n<p class=\"mb-4\"><strong>TorontoJS Tech Talk [Online]</strong> welcomes you to an electrifying virtual gathering where tech enthusiasts unite! Prepare for an immersive experience focused on cutting-edge tech talks, insightful discussions, and vibrant connections. Our highlight? A captivating presentation led by our esteemed guest host. Join us as they lead the way through an evening of curiosity, collaboration, and a deep dive into the world of JavaScript and beyond. Elevate your tech journey with us, and be part of an engaging experience where passion for code meets the thrill of learning.</p>\n<p class=\"mb-4\">ðŸ‘‹ Come out and join us with special guest <a href=\"https://twitter.com/hussien_coding\" target=\"_blank\" class=\"!text-viridian\" rel=\"ugc\">Hussien Khayoon</a> who will lead a talk on React Testing.</p>\n<p class=\"mb-4\">Hussien is a Staff Developer at Shopify. He has over 12 years of full-stack experience with a particular soft spot for React. He also mentors for a coding boot camp and loves helping beginners break into tech.</p>\n<p class=\"mb-4\">Hussien will be talking about testing with React to build high-quality software.</p>\n<p class=\"mb-4\"><strong>Schedule:</strong></p>\n<p class=\"mb-4\"><strong>6:30 pm</strong> - Introduction &amp; welcome notes from TorontoJS<br>\n<strong>6:40 pm</strong> - Hussien Khayoon<br>\n<strong>7:10 pm</strong> - Question Period and or mob programming<br>\n<strong>7:25 pm</strong> - Networking<br>\n<strong>7:40 PM</strong> - Final words</p>\n<p class=\"mb-4\"><strong>We look forward to seeing you!</strong></p>\n<p class=\"mb-4\">The event will be held on <a href=\"https://zoom.us/j/93451964000\" target=\"_blank\" class=\"!text-viridian\" rel=\"nofollow ugc\">zoom</a>.</p>\n<p class=\"mb-4\">We're always looking for speakers and sponsors for our events. Reach to us @ [<a href=\"http://organizers@torontojs.com\" target=\"_blank\" class=\"!text-viridian\" rel=\"nofollow ugc\">organizers@torontojs.com</a>](<a href=\"http://mailto:organizers@torontojs.com\" target=\"_blank\" class=\"!text-viridian\" rel=\"nofollow ugc\">mailto:organizers@torontojs.com</a>)</p>\n<p class=\"mb-4\">Learn more about all our <a href=\"https://guild.host/torontojs/events\" target=\"_blank\" class=\"!text-viridian\" rel=\"nofollow ugc\">events</a></p>\n<p class=\"mb-4\"><a href=\"https://torontojs.com/p/code_of_conduct\" target=\"_blank\" class=\"!text-viridian\" rel=\"nofollow ugc\">Code of Conduct</a> is enforced online or in person at all TorontoJS events and spaces.</p></div>",
  "tags": [
    "Events in",
    "JavaScript",
    "Open Source",
    "JavaScript Frameworks",
    "Software Engineering",
    "Web Development"
  ]
}