{
	"title": "TorontoJS [ ONLINE ] TechTalk - CTO Roles and responsibiliies: Ahmad Nassri",
	"hosts": [
		"Ken B."
	],
	"startDate": "2024-10-31T18:30:00-04:00",
	"endDate": "2024-10-31T18:30:00-04:00",
	"status": "active",
	"locationType": "virtual",
	"image": "./images/600_523977525.webp",
	"tags": [
		"Events in",
		"Leadership",
		"JavaScript",
		"Chief Technology Officer",
		"Technology Startups",
		"CIO / CTO"
	],
	"details": "Details\n-------\n\nðŸ™Œ **TorontoJS Tech Talks \\[ Online \\] is back again!**\n\nWe're thrilled to announce the return of TorontoJS Tech Talks to the virtual stage! In this session, we're diving into the topic CTO's and their responsibilities!\n\nðŸ‘‹ **Meet Our Special Guest,**  \n[Ahmad Nassri](https://www.linkedin.com/in/ahmadnassri/)\n\n**Schedule:**  \n**6:30 pm**\\- Warm welcome and introduction by TorontoJS  \n**6:10 pm** - Presentation by our esteemed speaker.  \n**7:00 m** - Interactive Q&A Session  \n**7:15 pm** - Neworking  \n**8:00 PM** - Closing Remarks\n\nThis event will unfold on Zoom, bringing together minds from everywhere in an inspiring virtual space.\n\nInterested in speaking, voluntering or sponsoring? Let's connect at ken\\[[@torontojs.com](http://@torontojs.com)\\]([mailto:organizers@torontojs.com](http://mailto:organizers@torontojs.com)).\n\nTorontoJS is committed to creating a safe and inclusive environment for all. Our Code of Conduct applies both online and in person at all our events and spaces.\n\nFor more information on events @ TorontoJS please check out:  \n[https://guild.host/torontojs/events](https://guild.host/torontojs/events)\n\nSee you there!"
}
