{
  "title": "JS Tech Talk [In-Person] - Filesystems, and QwikJS",
  "hosts": [
    "Aman A.",
    "sami x."
  ],
  "startDate": "2024-02-27T18:00:00-05:00",
  "endDate": "2024-02-27T18:00:00-05:00",
  "status": "active",
  "locationType": "in-person",
  "image": "https://secure.meetupstatic.com/photos/event/a/3/3/1/600_510821777.webp?w=750",
  "details": "<div class=\"flex items-center justify-between\"><h2 class=\"text-xl font-semibold\">Details</h2></div><div class=\"break-words\"><p class=\"mb-4\"><strong>ðŸ™Œ Welcome back to our first meetup of 2024!</strong></p>\n<p class=\"mb-4\">We welcome you to our February 2024 In-Person Tech Talk Meetup at <strong><a href=\"http://Super.com\" target=\"_blank\" class=\"!text-viridian\" rel=\"nofollow ugc\">Super.com</a></strong>! ðŸ‘‹</p>\n<p class=\"mb-4\">Come out and join us for a special event with our members who are coming together to share their knowledge with the community.</p>\n<p class=\"mb-4\"><strong>NOTE:</strong> RSVP on our Guild page: <a href=\"https://guild.host/events/js-tech-talk-inperson-z5zmjq\" target=\"_blank\" class=\"!text-viridian\" rel=\"nofollow ugc\">https://guild.host/events/js-tech-talk-inperson-z5zmjq</a></p>\n<p class=\"mb-4\"><strong>Schedule:</strong><br>\n<strong>6:00 pm</strong> - Doors Open</p>\n<p class=\"mb-4\"><strong>6:20 pm</strong> - Welcome notes from TorontoJS</p>\n<p class=\"mb-4\"><strong>6:30 pm</strong> - Welcome from our hosts - Super.com</p>\n<p class=\"mb-4\"><strong>6:35 pm</strong> - <strong>Introduction to QwikJS : build blazing fast web apps at the Edge</strong> - by Brandon Cha<br>\nAbout Brandon: \"<em>Brandon Cha (he/him) is a Software Developer who loves exploring different cultures through food, travel, and experiences. He previously worked in development as a B2B and B2C solutions consultant primarily within the media and entertainment industry, he likes to discover and find creative solutions to solve the next challenge in web and application development from frontend to the backend. In this talk, Brandon will be sharing with us how the QwikJS framework is easy to use and setup, and why its envious Edge-optimized loading time shows us a glimpse of the future in how frontend development is built and deployed.</em>\"</p>\n<p class=\"mb-4\"><strong>7:05 pm</strong> - <strong>Introductions to File Systems</strong> - by Evert Pot<br>\nAbout Evert: \"<em>Evert Pot has been building web applications for 20 years and is currently CTO at Sprout Family. Check out his blog: <a href=\"https://evertpot.com\" target=\"_blank\" class=\"!text-viridian\" rel=\"nofollow ugc\">https://evertpot.com</a></em>\"</p>\n<p class=\"mb-4\"><strong>7:35 pm</strong> - Networking</p>\n<p class=\"mb-4\"><strong>9:00 pm</strong> - Doors Close</p>\n<p class=\"mb-4\">(Note: All times in the schedule are an approximation.)</p>\n<p class=\"mb-4\"><strong>Many thanks to <a href=\"http://Super.com\" target=\"_blank\" class=\"!text-viridian\" rel=\"nofollow ugc\">Super.com</a> for hosting us!</strong></p>\n<p class=\"mb-4\">----</p>\n<p class=\"mb-4\">We're looking for sponsors for events like these. If you or your company would like to support TorontoJS and get a message out to our community, please get in touch with <a href=\"http://organizers@torontojs.com\" target=\"_blank\" class=\"!text-viridian\" rel=\"nofollow ugc\">organizers@torontojs.com</a></p>\n<p class=\"mb-4\">The <a href=\"https://torontojs.com/p/code_of_conduct\" target=\"_blank\" class=\"!text-viridian\" rel=\"nofollow ugc\">Code of Conduct</a> is enforced at all TorontoJS events and spaces - online or in-person.</p>\n<p class=\"mb-4\">Gendered toilets and a single occupancy accessible toilet are available.<br>\nTorontoJS is a volunteer-led not-for-profit organization. Please help us with tidying up; otherwise, the venue staff and volunteers have to pick up after you.</p>\n<p class=\"mb-4\"><strong>IMPORTANT:</strong> Attendees must RSVP on Guild: <a href=\"https://guild.host/events/js-tech-talk-inperson-z5zmjq\" target=\"_blank\" class=\"!text-viridian\" rel=\"nofollow ugc\">https://guild.host/events/js-tech-talk-inperson-z5zmjq</a></p></div>",
  "tags": [
    "Events in Toronto, ON",
    "JavaScript",
    "JavaScript Applications",
    "JavaScript Frameworks",
    "JavaScript Libraries",
    "Web Technology"
  ]
}