{
  "title": "JS Workshop for Women Developers [In Person] - RSVP Link in description!",
  "hosts": [],
  "startDate": "2023-10-04T18:00:00-04:00",
  "endDate": "2023-10-04T18:00:00-04:00",
  "status": "active",
  "locationType": "in-person",
  "image": "./images/600_515919032.webp",
  "tags": [
    "Events in Toronto, ON",
    "Public Speaking",
    "JavaScript",
    "JavaScript Libraries",
    "Women's Empowerment",
    "Technical Communicators"
  ],
  "details": "Details\n-------\n\nUnlock the power of communication at Code & Communicate: a workshop for women developers!\n\n[Register here](https://guild.host/events/code-communicate-a-workshop-vx61iq) to reserve your spot!!\n\n**The Big Picture:**\n\nJoin like-minded women to learn from experts and participate in a workshop designed to elevate your technical documentation, cross-team collaboration, and public speaking at this **in-person** event.\n\nTake advantage a supportive environment focused on the unique challenges and opportunities facing women in development and participate in three facilitated breakout sessions:\n\nMaster Technical Documentation\n\n*   Learn the art of crafting technical documentation that drives project success and get hands-on experience in creating clear, concise content.\n\nBridge the Gap with Non-Technical Teams\n\n*   Get tips on navigating the complexities of cross-team collaboration. Practice translating tech jargon into language everyone can understand.\n\nConquer Public Speaking\n\n*   Overcome stage fright and captivate your audience with confidence. Receive expert guidance and a unique opportunity to practice delivering clear, compelling presentations.\n\n**The Details:**\n\nCost: $10 - this cost will cover pizza.\n\nWho should join? - Women in software development (any level of experience).\n\nWhere? - Near Toronto’s financial core.\n\nWhat to bring? - Your laptop and an open mind!\n\n_**Space for this event is limited! [Registration](https://guild.host/events/code-communicate-a-workshop-vx61iq) and payment is required.**_\n\nStep 1: Register to attend on [Guild](https://guild.host/events/code-communicate-a-workshop-vx61iq).  \nStep 2: You will receive an email with instructions on payment.  \nStep 3: You will receive an email with venue details.\n\n**Meet the Experts:**\n\nNiya Panamdanam is a senior software engineer with over 6 years of front-end expertise. She is a passionate advocate for women in the tech industry and emphasizes the significance of thorough technical documentation and efficient technical debt management. She serves as the engineering team lead at Healthie, a healthcare SaaS firm.\n\nNatasha Kasunic is a passionate speaker who has captured all kinds of audiences including executives, peers, students, 1000+ person crowds and smaller project groups both online and in-person. She has a double degree in business and computer science and is currently a product manager at marketing tech firm, Environics Analytics.\n\n**Meet Your Hosts:**\n\nZeinab Farag is a full stack developer with about 2 years of experience. She is a career-transitioner starting off in the life sciences and breaking into the tech industry after joining a web development bootcamp. She joined TorontoJS early 2023 and is looking forward to organizing events that are as informative and exciting as the ones that have inspired her in the past.\n\nChantal Gagnon recently landed in Toronto from NYC where she spent the last decade working with aspiring entrepreneurs and companies in finance, high-ed, and tech before joining Salesforce’s innovation team where she is now. Passionate about empowering women, she co-founded a unique event series that fuses meditation and design thinking to help women confidently find their voice.\n\n[Code of Conduct](https://torontojs.com/?p=/p/code_of_conduct) is enforced at all TorontoJS events\n\nRegister [here](https://guild.host/events/code-communicate-a-workshop-vx61iq)."
}
