{
  "title": "JS Social: Online",
  "hosts": [
    "Matthew M.",
    "Sherry Y."
  ],
  "startDate": "2023-07-26T18:00:00-04:00",
  "endDate": "2023-07-26T18:00:00-04:00",
  "status": "active",
  "locationType": "virtual",
  "image": "https://secure.meetupstatic.com/photos/event/e/3/8/8/600_510478248.webp?w=750",
  "tags": [
    "Events in",
    "JavaScript",
    "JavaScript Applications",
    "JavaScript Frameworks",
    "JavaScript Libraries",
    "Web Technology"
  ],
  "details": "Details\n-------\n\nWelcome, if you're new here! We've made **JS Social: Online** a regular online social event now.\n\nFriends + Code = LOVE!\n\nTorontoJS Social is our lightest event where like minds get together, have a snack or drink, and talk javascript/coding. Feel free to bring your project and questions, but there is no specific programming/talk portion to the event.\n\nWe'll be **Online** for the last Wednesday of the month! Come talk JavaScript, Development, and Community!\n\nThis event is open to all skill levels.  \n[Code of conduct](https://torontojs.com/p/code_of_conduct) is enforced at all TorontoJS events\n\n**IMPORTANT: Guild Migration**  \nWe're migrating to a new platform for Events & Presentations - Guild!  \nPlease register for this event on [TorontoJS Guild](https://guild.host/torontojs/events)"
}