{
  "title": "TorontoJS [ ONLINE ] TechTalk - Security in software releases",
  "hosts": [
    "Ken B."
  ],
  "startDate": "2024-09-28T15:00:00-04:00",
  "endDate": "2024-09-28T15:00:00-04:00",
  "status": "active",
  "locationType": "virtual",
  "image": "https://secure.meetupstatic.com/photos/event/8/d/7/3/600_523536211.webp?w=750",
  "details": "<div class=\"flex items-center justify-between\"><h2 class=\"text-xl font-semibold\">Details</h2></div><div class=\"break-words\"><p class=\"mb-4\"># TorontoJS [ ONLINE ] TechTalk - Security in software releases: Aristide Bouix &amp; Srgjan Dimitrijevikj</p>\n<p class=\"mb-4\">ðŸ™Œ <strong>TorontoJS Tech Talks [ Online ] is back again!</strong><br>\nWe're thrilled to announce the return of TorontoJS Tech Talks to the virtual stage! In this session, we're diving into the topic of security in software releases!</p>\n<p class=\"mb-4\">ðŸ‘‹ <strong>Meet Our Special Guest,</strong><br>\n<a href=\"https://www.linkedin.com/in/aristide-bouix/\" target=\"_blank\" class=\"!text-viridian\" rel=\"ugc\">Aristide Bouix </a>Head Of Product Security and <a href=\"https://www.linkedin.com/in/srgjan-dimitrijevikj-2a196130/\" target=\"_blank\" class=\"!text-viridian\" rel=\"ugc\">Srgjan Dimitrijevikj </a>principle software engineering security and growth <a href=\"https://x.com/catawiki\" target=\"_blank\" class=\"!text-viridian\" rel=\"nofollow ugc\">@Catawiki.</a></p>\n<p class=\"mb-4\"><strong>Schedule:</strong><br>\n<strong>3:00 pm</strong>- Warm welcome and introduction by TorontoJS<br>\n<strong>3:10 pm</strong> - Presentation by our esteemed speakers.<br>\n<strong>4:00 pm</strong> - Interactive Q&amp;A Session<br>\n<strong>4:15 pm</strong> - Neworking<br>\n<strong>4:30 PM</strong> - Closing Remarks</p>\n<p class=\"mb-4\">This event will unfold on Zoom, bringing together minds from everywhere in an inspiring virtual space.</p>\n<p class=\"mb-4\">Interested in speaking or sponsoring? Let's connect at sponsor[<a href=\"http://@torontojs.com\" target=\"_blank\" class=\"!text-viridian\" rel=\"nofollow ugc\">@torontojs.com</a>](<a href=\"http://mailto:organizers@torontojs.com\" target=\"_blank\" class=\"!text-viridian\" rel=\"nofollow ugc\">mailto:organizers@torontojs.com</a>).</p>\n<p class=\"mb-4\">TorontoJS is committed to creating a safe and inclusive environment for all. Our Code of Conduct applies both online and in person at all our events and spaces.</p>\n<p class=\"mb-4\">For more information on events @ TorontoJS please check out:<br>\n<a href=\"https://guild.host/torontojs/events\" target=\"_blank\" class=\"!text-viridian\" rel=\"nofollow ugc\">https://guild.host/torontojs/events</a><br>\nSee you there!</p></div>",
  "tags": [
    "Events in",
    "Software Security",
    "JavaScript",
    "Functional Programming",
    "Software Development",
    "Web Development"
  ]
}