{
  "title": "Toronto JS Tech Talk Event [in person]",
  "hosts": [
    "sami x.",
    "2 others"
  ],
  "startDate": "2024-06-06T17:30:00-04:00",
  "endDate": "2024-06-06T17:30:00-04:00",
  "status": "active",
  "locationType": "in-person",
  "image": "https://secure.meetupstatic.com/photos/event/d/f/3/2/600_521097138.webp?w=750",
  "details": "<div class=\"flex items-center justify-between\"><h2 class=\"text-xl font-semibold\">Details</h2></div><div class=\"break-words\"><p class=\"mb-4\">Welcome back folks, to another exciting Tech Talk event at Snowflake on June 6th! Tonight is going to be exceptional, with not one, not two, but three fantastic speakers lined up, each ready to do a <strong>30-minute talk</strong> about a variety of topics. And guess what? <strong>There will be pizza and non-alcoholic drinks waiting for you too!</strong></p>\n<p class=\"mb-4\">We are also thrilled to announce that Alex Okrushko from AngularToronto Meetup will be joining our event as one of the hosts and our MC for the evening. Make sure to mark your calendars and come out and join us for this very special event and discover what he has in store for us!</p>\n<p class=\"mb-4\">We are still finalizing the tech talks, and will update the agenda when we have more details, but here's a quick rundown of the schedule for the day:</p>\n<p class=\"mb-4\"><strong>FEATURING</strong><br>\n<strong>\"React TypeScript Patterns\"</strong> by Hassan Djirdeh<br>\n<a href=\"https://www.linkedin.com/in/hassandjirdeh/\" target=\"_blank\" class=\"!text-viridian\" rel=\"ugc\">https://www.linkedin.com/in/hassandjirdeh/</a></p>\n<p class=\"mb-4\"><strong>\"TypeScript's Magic: Achieving End-to-End Type Safety Across the Full Stack\"</strong> by Joe Zhou<br>\n<a href=\"https://www.linkedin.com/in/zhehuizhou/\" target=\"_blank\" class=\"!text-viridian\" rel=\"ugc\">https://www.linkedin.com/in/zhehuizhou/</a></p>\n<p class=\"mb-4\"><strong>\"Performance Optimization in <a href=\"http://Next.js:\" target=\"_blank\" class=\"!text-viridian\" rel=\"nofollow ugc\">Next.js:</a> Tips and Techniques\"</strong> by Devang Sharma<br>\n<a href=\"https://www.linkedin.com/in/devang25/\" target=\"_blank\" class=\"!text-viridian\" rel=\"ugc\">https://www.linkedin.com/in/devang25/</a></p>\n<p class=\"mb-4\"><strong>Schedule:</strong><br>\n<strong>5:30pm</strong> - doors \"open\"<br>\n<strong>6:00pm to 6:30pm</strong> - \"TypeScript's Magic: Achieving End-to-End Type Safety Across the Full Stack\" by Joe Zhou<br>\n<strong>6:30pm to 7:00pm</strong> - \"React TypeScript Patterns\" by Hassan Djirdeh<br>\n<strong>7:00pm to 7:30pm</strong> - 30mins break time<br>\n<strong>7:30pm to 8:00pm</strong> - \"Performance Optimization in Next.js: Tips and Techniques\" by Devang Sharma<br>\n<strong>8:00pm to 9:00pm</strong> - networking time<br>\n<strong>9:00pm</strong> - everyone goes \"home\"</p>\n<p class=\"mb-4\"><strong>Please RSVP to confirm your attendance.</strong> If you have your friends or teammates joining please ask them to RSVP as well.</p>\n<p class=\"mb-4\"><strong>You can also RSVP at Guild:</strong><br>\n<a href=\"https://guild.host/events/js-tech-talk-in-person-x0nqk7\" target=\"_blank\" class=\"!text-viridian\" rel=\"nofollow ugc\">https://guild.host/events/js-tech-talk-in-person-x0nqk7</a></p>\n<p class=\"mb-4\">This event is open to all skill levels.</p>\n<p class=\"mb-4\">Many thanks to Snowflake for hosting us!</p>\n<p class=\"mb-4\">We're looking for sponsors for events like these. If you or your company would like to support TorontoJS and get a message out to our community, please get in touch with [<a href=\"http://organizers@torontojs.com\" target=\"_blank\" class=\"!text-viridian\" rel=\"nofollow ugc\">organizers@torontojs.com</a>](<a href=\"http://mailto:organizers@torontojs.com\" target=\"_blank\" class=\"!text-viridian\" rel=\"nofollow ugc\">mailto:organizers@torontojs.com</a>)<br>\nThe Code of Conduct is enforced at all TorontoJS events and spaces - online or in-person.</p>\n<p class=\"mb-4\">Gendered toilets and a single occupancy accessible toilet are available.<br>\nTorontoJS is a volunteer-led not-for-profit organization. Please help us with tidying up. otherwise, the venue staff and volunteers will have to pick up after you.</p></div>",
  "tags": [
    "Events in Toronto, ON",
    "JavaScript",
    "JavaScript Applications",
    "JavaScript Frameworks",
    "JavaScript Libraries",
    "Web Technology"
  ]
}