{
  "title": "TorontoJS Code Buddy Club online - Javascript Internationalization Object",
  "hosts": [
    "Elizabeth M.",
    "2 others"
  ],
  "startDate": "2024-03-24T11:00:00-04:00",
  "endDate": "2024-03-24T11:00:00-04:00",
  "status": "active",
  "locationType": "virtual",
  "image": "https://secure.meetupstatic.com/photos/event/4/8/2/a/600_518058474.webp?w=750",
  "details": "<div class=\"flex items-center justify-between\"><h2 class=\"text-xl font-semibold\">Details</h2></div><div class=\"break-words\"><p class=\"mb-4\">## What is a Code Buddy Club</p>\n<ul class=\"pl-5 list-disc mb-4\">\n<li>It's similar to a book club but uses free courses and tutorials instead of books</li>\n<li>Participants are free to code independently, or to pair program.</li>\n<li>Meet on discord to share progress, provide support, and help with debugging</li>\n<li>Each course should take roughly 1 - 8 weeks to complete</li>\n<li>It's a really relaxed, supportive, and social atmosphere.</li>\n</ul>\n<p class=\"mb-4\">## 2024 Courses List and Schedule</p>\n<p class=\"mb-4\">### Regular meetings</p>\n<ul class=\"pl-5 list-disc mb-4\">\n<li>Sundays 11am-12pm</li>\n<li>Tuesdays 6:30pm-7:30pm</li>\n<li>Location: TorontoJS Discord on the Code Buddy Channel <a href=\"https://discord.com/channels/1078763949132107926/1183920018799472784\" target=\"_blank\" class=\"!text-viridian\" rel=\"nofollow ugc\">https://discord.com/channels/1078763949132107926/1183920018799472784</a></li>\n<li>** Contact us on Slack if you need a Discord Invite! <a href=\"https://join.slack.com/t/torontojs/shared_invite/zt-zgi31snl-omO3tXSZ0Q7zqN9WBQSf8Q\" target=\"_blank\" class=\"!text-viridian\" rel=\"nofollow ugc\">https://join.slack.com/t/torontojs/shared_invite/zt-zgi31snl-omO3tXSZ0Q7zqN9WBQSf8Q</a></li>\n</ul>\n<p class=\"mb-4\"><strong>Course</strong></p>\n<ul class=\"pl-5 list-disc mb-4\">\n<li><strong>Javascript Internationalization Object</strong></li>\n<li><a href=\"https://egghead.io/courses/javascript-internationalization-object-b62d898e\" target=\"_blank\" class=\"!text-viridian\" rel=\"nofollow ugc\">https://egghead.io/courses/javascript-internationalization-object-b62d898e</a></li>\n</ul>\n<p class=\"mb-4\">Full Schedule and Course List: January - June 2024:</p>\n<p class=\"mb-4\">[code-buddy-club/Code Buddy Club <a href=\"http://Schedule.md\" target=\"_blank\" class=\"!text-viridian\" rel=\"nofollow ugc\">Schedule.md</a> at main · torontojs/code-buddy-club (<a href=\"http://github.com\" target=\"_blank\" class=\"!text-viridian\" rel=\"nofollow ugc\">github.com</a>)](<a href=\"https://github.com/torontojs/code-buddy-club/blob/main/Code%20Buddy%20Club%20Schedule.md\" target=\"_blank\" class=\"!text-viridian\" rel=\"nofollow ugc\">https://github.com/torontojs/code-buddy-club/blob/main/Code%20Buddy%20Club%20Schedule.md</a>)<br>\n<strong>Alt text for cover image</strong> Rectangular graphic. Medium red background. Text says: TorontoJS, underneath inside curly brackets is three lines of text Code Buddy, then a hug happy face emoji then the word Club. There’s a stylized grey graphic of the CN tower on the left.</p></div>",
  "tags": [
    "Events in",
    "JavaScript",
    "Web Technology",
    "JavaScript Applications",
    "JavaScript Libraries"
  ]
}