{
  "title": "Accessibility for Devs Series: Online Talk and Workshop",
  "hosts": [
    "Elizabeth M.",
    "Marco C."
  ],
  "startDate": "2024-10-21T18:00:00-04:00",
  "endDate": "2024-10-21T18:00:00-04:00",
  "status": "canceled",
  "locationType": "virtual",
  "image": "https://secure.meetupstatic.com/photos/event/3/6/2/7/600_522193863.webp?w=750",
  "details": "<div class=\"flex items-center justify-between\"><h2 class=\"text-xl font-semibold\">Details</h2></div><div class=\"break-words\"><p class=\"mb-4\"><strong>This is our third Accessibility for Devs event and the second online one!</strong></p>\n<ul class=\"pl-5 list-disc mb-4\">\n<li>Would you like to advance your career and improve your software development skills with accessibility in mind?</li>\n<li>Are you curious about accessibility (\"a11y\") but don't know where to start?</li>\n<li>Have you attended other web accessibility events, but they seem to be geared more to designers and product managers?</li>\n<li>Do you know that accessibility is becoming increasingly important for legal, business, and human rights reasons?</li>\n<li></li>\n</ul>\n<p class=\"mb-4\"><strong>Well then this is the series for you!</strong><br>\nThe Accessibility for Devs Talk &amp; Workshop Series is designed for developers and run by developers. Every event will have a live coding demo and/or hands on practice so you can level up your skills.<br>\n<strong>About</strong> <strong>Accessibility for Devs Talk &amp; Workshop Series:</strong></p>\n<ul class=\"pl-5 list-disc mb-4\">\n<li>On the third Monday of every month</li>\n<li>Alternating between online and in-person events</li>\n<li>Open to all skill levels</li>\n<li>Coding focus but no accessibility knowledge required</li>\n<li>Run by the new Accessibility Team at TorontoJS!</li>\n</ul>\n<p class=\"mb-4\"><strong>Accessibility of</strong> <strong>Accessibility for Devs Talk &amp; Workshop Series</strong>:<br>\n(Because accessibility isn't just about users!)</p>\n<ul class=\"pl-5 list-disc mb-4\">\n<li>All in-person events will be wheelchair accessible and have easy access to an accessible subway station or streetcar route.</li>\n<li>Online events will have auto captioning enabled and presenters/hosts will do our best to provide described audio of visuals.</li>\n<li>Talks uploaded to YouTube will have both captions and transcripts (<em>Please note: It may take a while for the first few YouTube videos to have captions and transcripts as we are setting up the new accessibility team. We're looking for volunteers!</em>)</li>\n</ul>\n<p class=\"mb-4\">***<br>\n<strong>About TorontoJS:</strong> ‚ÑπÔ∏è<br>\n<strong>Did you know that our members and volunteers are not just in Toronto, and that we're not just JavaScript!</strong> We welcome people from any field in tech and with any level of skills - from students and those considering a career change up to seasoned professionals with decades of experience.<br>\nTorontoJS is dedicated to providing a welcoming, safe, inclusive and supportive environment for all regardless of their gender, sexual orientation, disability, physical appearance, body size, race, or religion.<br>\nPlease read the <a href=\"https://torontojs.com/code_of_conduct\" target=\"_blank\" class=\"!text-viridian\" rel=\"nofollow ugc\">code of conduct</a> prior to attending this meeting. <a href=\"https://torontojs.com/code_of_conduct\" target=\"_blank\" class=\"!text-viridian\" rel=\"nofollow ugc\">https://torontojs.com/code_of_conduct</a><br>\nWe welcome and encourage people who are disabled, neurodivergent, deaf/Deaf, LGBTQ2S+, and BIPOC, to attend events, get involved as members and to volunteer!<br>\n***<br>\n<strong>Connect With TorontoJS üîó</strong></p>\n<ul class=\"pl-5 list-disc mb-4\">\n<li>Website: <a href=\"https://torontojs.com/\" target=\"_blank\" class=\"!text-viridian\" rel=\"nofollow ugc\">https://torontojs.com</a></li>\n<li><a href=\"https://join.slack.com/t/torontojs/shared_invite/zt-zgi31snl-omO3tXSZ0Q7zqN9WBQSf8Q\" target=\"_blank\" class=\"!text-viridian\" rel=\"nofollow ugc\">Join us on Slack!</a></li>\n<li>Follow us on LinkedIn: <a href=\"https://www.linkedin.com/company/torontojs/\" target=\"_blank\" class=\"!text-viridian\" rel=\"ugc\">https://www.linkedin.com/company/torontojs/</a></li>\n<li>You can also find TorontoJS events on <a href=\"http://Guild.host:\" target=\"_blank\" class=\"!text-viridian\" rel=\"nofollow ugc\">Guild.host:</a> <a href=\"https://guild.host/torontojs/events\" target=\"_blank\" class=\"!text-viridian\" rel=\"nofollow ugc\">https://guild.host/torontojs/events</a></li>\n</ul>\n<p class=\"mb-4\">***<br>\n<strong>Alt text for cover image:</strong><br>\nText: Accessibility for Devs Talk &amp; Workshop Series In-Person<br>\nTalk and Workshop<br>\nTopic: TBA<br>\nLocation: Toronto TBA<br>\nDesign: Dark theme, black background, white text on the left and centre. Top left:White universal accessibility icon<br>\nOn the right there's a stylized grey CN tower on a red background that looks like flood lights shining up from the ground.</p></div>",
  "tags": [
    "Events in",
    "Web Accessibility",
    "JavaScript",
    "Software Development",
    "Web Development",
    "Tech Talks"
  ]
}