{
  "title": "New Volunteer Information and Orientation Online Meeting!",
  "hosts": [
    "Elizabeth M.",
    "Marco C."
  ],
  "startDate": "2024-08-20T18:30:00-04:00",
  "endDate": "2024-08-20T18:30:00-04:00",
  "status": "canceled",
  "locationType": "virtual",
  "image": "https://secure.meetupstatic.com/photos/event/c/4/9/0/600_522350320.webp?w=750",
  "tags": [
    "Events in",
    "Volunteering",
    "UX Design",
    "Accessibility",
    "Professional Women",
    "Web Development"
  ],
  "details": "Details\n-------\n\n**Do you want to be part of an awesome community that's one of the largest tech meetups in the world, while gaining career experience, building a portfolio, and developing your leadership skills and professional portfolio?**\n\nTorontoJS is recruiting volunteers for in-person, hybrid, and remote positions!\n\n**Did you know that our members and volunteers are not just in Toronto, and that we're not just JavaScript!** We welcome people from any field in tech and with any level of skills - from students and those considering a career change up to seasoned professionals with decades of experience.\n\nTorontoJS is dedicated to providing a welcoming, safe, inclusive and supportive environment for all regardless of their gender, sexual orientation, disability, physical appearance, body size, race, or religion.  \nPlease read the [code of conduct](https://torontojs.com/code_of_conduct) prior to attending this meeting. [https://torontojs.com/code\\_of\\_conduct](https://torontojs.com/code_of_conduct)\n\n**We're growing!**  \n**There's four new teams with a wide range of programs and various levels of volunteer roles:**\n\n1.  Volunteer Management Team\n2.  Accessibility Team\n3.  Design Team\n4.  Women in Tech\n\nWe also need events volunteers for both in-person and online events.\n\nCommitment for roles ranges from one evening a month and/or half an hour a week, through to leadership positions with long-term commitments.  \nAll volunteers will be invited to attend volunteer only special events including the new \"May the Fourth annual volunteer party\"!\n\nThis is a meeting for new and existing volunteers interested in positions for:\n\n*   The new Design Team,\n*   Volunteer management team,\n*   Accessibility team, and\n*   Women in Tech team (leadership)\n*   In-person and online Events,\n\nThis meeting will cover:\n\n*   History and info about TorontoJS\n*   About how TorontoJS is growing.\n*   The new Volunteer Management Software (VMS) development project.\n*   Current and future volunteer positions\n*   Timelines\n*   Expectations\n*   Volunteer benefits\n*   how these positions will help TorontoJS members and volunteers\n*   Q&A\n\n**Connect With TorontoJS**\n\n*   Website: [https://torontojs.com](https://torontojs.com)\n*   [Join us on Slack!](https://join.slack.com/t/torontojs/shared_invite/zt-zgi31snl-omO3tXSZ0Q7zqN9WBQSf8Q)\n*   Follow us on LinkedIn: [https://www.linkedin.com/company/torontojs/](https://www.linkedin.com/company/torontojs/)\n*   You can also find TorontoJS events on [Guild.host:](http://Guild.host:) [https://guild.host/torontojs/events](https://guild.host/torontojs/events)\n\nAlt text for cover image:  \nText:New Volunteer Info Meeting! Online  \nTuesday, August 20  \n6:30 PM to 7:20 PM  \nDesign: Dark theme, black background, white text on the left and centre. To the left of \"New\" is a raised hand icon. On the right there's a stylized grey CN tower on a red background that looks like flood lights shining up from the ground."
}